{
  "artifact_card_sha256": "112bcf35b63d187538fe2e6034035fec25e6a545315c312adfd08be42e0c22ae",
  "artifact_level": "review_ready_smoke",
  "artifact_review_score": 100,
  "availability": [
    {
      "bytes": 5903,
      "name": "readiness",
      "path": "docs/trice_suite_readiness.json",
      "present": true,
      "sha256": "f98e2481ce47a262e618f0adee5481ee7227347e900613bfc68115cc420be1d7"
    },
    {
      "bytes": 7194,
      "name": "protocol_lock",
      "path": "docs/trice_protocol_lock.json",
      "present": true,
      "sha256": "3e71413180ad94f43be0b6a35717ced48359b75ea382035c524a9b91e5e8296e"
    },
    {
      "bytes": 4605,
      "name": "design_card",
      "path": "docs/trice_design_card.json",
      "present": true,
      "sha256": "dffa666fb9ba1deff7ba467da24b68b7dd4c19d5f0b0fa2e8c0f3cb45be74d39"
    },
    {
      "bytes": 7294,
      "name": "reproduction_card",
      "path": "docs/trice_reproduction_card.json",
      "present": true,
      "sha256": "74ec65592fa039648a1b78fd73f133b6abf8a528ceb848fab35416ca02436cfa"
    },
    {
      "bytes": 19194,
      "name": "contract_card",
      "path": "docs/trice_contract_card.json",
      "present": true,
      "sha256": "f4635c58f7f396076b119fbe1e1bae5e14385ec7493c4142fd4e66840ca733b3"
    },
    {
      "bytes": 14035,
      "name": "install_card",
      "path": "docs/trice_install_card.json",
      "present": true,
      "sha256": "d5528d855bd86026b9f6279e4f4eaa23605e92209b56ad6f3f3c6775ce5f0892"
    },
    {
      "bytes": 69703,
      "name": "research_card",
      "path": "docs/trice_research_card.json",
      "present": true,
      "sha256": "c1753dfa8b6c68b9bb2a1ebda01a3e37bd022a6801d2b5e136b2e94e8d77b804"
    },
    {
      "bytes": 3861,
      "name": "claim",
      "path": "docs/trice_claim_card.json",
      "present": true,
      "sha256": "5bf4de6c6ae6c74b7bfcef12a924890ae633183ad8120d707f6531a9a1b8f9cf"
    },
    {
      "bytes": 3227,
      "name": "remote_smoke_claim",
      "path": "docs/trice_remote_smoke_claim_card.json",
      "present": true,
      "sha256": "e296651963ef02ccfde115ab59f0cc87e5d938548878ed63ef8f8660113da641"
    },
    {
      "bytes": 117764,
      "name": "evidence_bundle",
      "path": "benchmark/trice/results/v2-broad-smoke/trice_broad_smoke_evidence.trice.zip",
      "present": true,
      "sha256": "08ee5538891932f64e5c4e80ac63833257802b533d5b4a5a50adbe860b65a37c"
    },
    {
      "bytes": 25131,
      "name": "remote_smoke_bundle",
      "path": "benchmark/trice/results/v2-remote-smoke/trice_remote_smoke_evidence.trice.zip",
      "present": true,
      "sha256": "93f31fc51b6c75279b1dc8a637a46e51c7fd9f2aa3ea0ef45fe9d581ffef493d"
    },
    {
      "bytes": 7364,
      "name": "paper_manifest",
      "path": "paper/trice_v3_research_manifest.json",
      "present": true,
      "sha256": "4ca9de56f71c5498f84fdda4fdbc955bd5b0adcc45f7bb64869aa032010fb60a"
    },
    {
      "bytes": 45736,
      "name": "paper_result",
      "path": "benchmark/trice/results/v2-smoke/trice_v2_live_results.json",
      "present": true,
      "sha256": "edf72f856f37e2c773ffefc31c2ae0b06cab67cc6e456044df3ff03911b58d8a"
    },
    {
      "bytes": 24348,
      "name": "paper_tex",
      "path": "paper/trice_v3_research_paper.tex",
      "present": true,
      "sha256": "d2b054232679cedf748ccf2a3b95c283e3a148a57e7c0cbaafbde0a3ef527709"
    },
    {
      "bytes": 13384,
      "name": "paper_pdf",
      "path": "paper/trice_v3_research_paper.pdf",
      "present": true,
      "sha256": "238219dcdb923f0e35ef1f24772b4bda13ae4f40ac453bf347eca24196c831ca"
    },
    {
      "bytes": 20271,
      "name": "readme",
      "path": "README.md",
      "present": true,
      "sha256": "15fb513d3f5452528ce3ccacf7e625369064165973382c658ab59b239efde629"
    },
    {
      "bytes": 24319,
      "name": "library_doc",
      "path": "docs/trice_library.md",
      "present": true,
      "sha256": "09b3e7346ec3df51769f1d7719174f6a9c5b075eb6cb51f7bb9715a426905d90"
    }
  ],
  "checks": [
    {
      "name": "artifacts_available",
      "observed": "17/17",
      "passed": true,
      "required": "17/17 present"
    },
    {
      "name": "readiness_verifies",
      "observed": "smoke_ready",
      "passed": true,
      "required": "readiness hash and suite manifest hash verify"
    },
    {
      "name": "protocol_lock_verifies",
      "observed": "smoke_protocol_locked",
      "passed": true,
      "required": "protocol hash and deterministic suite rebuild verify"
    },
    {
      "name": "design_card_verifies",
      "observed": "smoke_design_observed",
      "passed": true,
      "required": "design-card hash and deterministic protocol/result rebuild verify"
    },
    {
      "name": "reproduction_card_verifies",
      "observed": "reviewer_replay_ready_smoke",
      "passed": true,
      "required": "reproduction-card hash, input hashes, and deterministic rebuild verify"
    },
    {
      "name": "contract_card_verifies",
      "observed": "library_contract_locked",
      "passed": true,
      "required": "public API/CLI/schema contract card verifies"
    },
    {
      "name": "install_card_verifies",
      "observed": "full_cli_install_ready",
      "passed": true,
      "required": "clean-wheel installability card verifies"
    },
    {
      "name": "research_card_verifies",
      "observed": "research_basis_locked",
      "passed": true,
      "required": "research-basis card verifies"
    },
    {
      "name": "claim_card_verifies",
      "observed": "smoke",
      "passed": true,
      "required": "claim-card hash and bound suite hashes verify"
    },
    {
      "name": "remote_smoke_claim_verifies",
      "observed": "smoke",
      "passed": true,
      "required": "remote-git smoke claim card hash and bound suite hashes verify"
    },
    {
      "name": "evidence_bundle_verifies",
      "observed": 77,
      "passed": true,
      "required": "bundle hashes and child manifests verify"
    },
    {
      "name": "remote_smoke_bundle_verifies",
      "observed": 17,
      "passed": true,
      "required": "remote-git smoke bundle hashes and child manifest verify"
    },
    {
      "name": "paper_manifest_verifies",
      "observed": 43,
      "passed": true,
      "required": "paper artifacts and result hash verify"
    },
    {
      "name": "schemas_available",
      "observed": "19/19",
      "passed": true,
      "required": "19/19 schemas present"
    },
    {
      "name": "claim_honesty",
      "observed": "smoke",
      "passed": true,
      "required": "non-S-tier evidence must not allow S-tier claim"
    },
    {
      "name": "remote_smoke_honesty",
      "observed": "smoke",
      "passed": true,
      "required": "remote smoke evidence must not allow S-tier claim"
    },
    {
      "name": "readiness_honesty",
      "observed": "smoke_ready",
      "passed": true,
      "required": "smoke package must not be claim-ready"
    }
  ],
  "claim_allowed": false,
  "input_sha256": {
    "claim": "5bf4de6c6ae6c74b7bfcef12a924890ae633183ad8120d707f6531a9a1b8f9cf",
    "contract_card": "f4635c58f7f396076b119fbe1e1bae5e14385ec7493c4142fd4e66840ca733b3",
    "design_card": "dffa666fb9ba1deff7ba467da24b68b7dd4c19d5f0b0fa2e8c0f3cb45be74d39",
    "evidence_bundle": "08ee5538891932f64e5c4e80ac63833257802b533d5b4a5a50adbe860b65a37c",
    "install_card": "d5528d855bd86026b9f6279e4f4eaa23605e92209b56ad6f3f3c6775ce5f0892",
    "library_doc": "09b3e7346ec3df51769f1d7719174f6a9c5b075eb6cb51f7bb9715a426905d90",
    "paper_manifest": "4ca9de56f71c5498f84fdda4fdbc955bd5b0adcc45f7bb64869aa032010fb60a",
    "paper_pdf": "238219dcdb923f0e35ef1f24772b4bda13ae4f40ac453bf347eca24196c831ca",
    "paper_result": "edf72f856f37e2c773ffefc31c2ae0b06cab67cc6e456044df3ff03911b58d8a",
    "paper_tex": "d2b054232679cedf748ccf2a3b95c283e3a148a57e7c0cbaafbde0a3ef527709",
    "protocol_lock": "3e71413180ad94f43be0b6a35717ced48359b75ea382035c524a9b91e5e8296e",
    "readiness": "f98e2481ce47a262e618f0adee5481ee7227347e900613bfc68115cc420be1d7",
    "readme": "15fb513d3f5452528ce3ccacf7e625369064165973382c658ab59b239efde629",
    "remote_smoke_bundle": "93f31fc51b6c75279b1dc8a637a46e51c7fd9f2aa3ea0ef45fe9d581ffef493d",
    "remote_smoke_claim": "e296651963ef02ccfde115ab59f0cc87e5d938548878ed63ef8f8660113da641",
    "reproduction_card": "74ec65592fa039648a1b78fd73f133b6abf8a528ceb848fab35416ca02436cfa",
    "research_card": "c1753dfa8b6c68b9bb2a1ebda01a3e37bd022a6801d2b5e136b2e94e8d77b804"
  },
  "next_actions": [
    "Publish the artifact card with the release assets.",
    "Run the held-out remote pilot, then regenerate readiness, protocol, design, reproduction, contract, claim, bundle, paper, and artifact cards.",
    "Do not upgrade the README to S-tier passed until claim_allowed is true on held-out evidence."
  ],
  "readiness_level": "smoke_ready",
  "research_basis": [
    "ACM-style artifact review: availability, functionality, reusability, and reproducibility must be explicit.",
    "Agent-evaluation research: cost, repeated trials, and verifiable environments are part of the benchmark, not an appendix.",
    "Benchmark-submission practice: locked inputs, fixed revisions, and portable evidence bundles make small public smoke runs reviewable without inflating them into broad claims.",
    "Contract-card practice: SemVer, public imports, CLI commands, schemas, examples, and docs must be declared before users can trust a library compatibility promise.",
    "TRICE rule: a paper claim is reviewable only when the protocol lock, design card, reproduction card, contract card, installability card, README, paper, readiness card, claim card, bundle, and schemas verify together.",
    "Research-card practice: the literature ledger is a versioned product input, so paper and README claims should fail review when the source basis drifts."
  ],
  "schema_version": "trice-artifact-card/v1",
  "schemas": [
    {
      "bytes": 1772,